{
  "job_id": "baseline2",
  "task_id": "pylint-dev__pylint-6528",
  "arm": "control",
  "model": "claude-haiku-5-5",
  "droid_version": "0.249.0",
  "stop_mode": "next_user_turn",
  "trial": 1,
  "passed": true,
  "grader": "swebench",
  "evidence_role": "final",
  "cost_credits": 11174,
  "timed_out": false,
  "session_id": "baseline2-pylint-dev__pylint-6528-1"
}
