{
  "job_id": "baseline2",
  "task_id": "pytest-dev__pytest-7490",
  "arm": "control",
  "model": "claude-haiku-5-5",
  "droid_version": "0.249.0",
  "stop_mode": "next_user_turn",
  "trial": 2,
  "passed": true,
  "grader": "swebench",
  "evidence_role": "final",
  "cost_credits": 2884,
  "timed_out": false,
  "session_id": "baseline2-pytest-dev__pytest-7490-2"
}
